{
  "contract_id": "WGT-V11-R5-ENDPOINT-STATISTICS-SAMPLE-SEED-RESOURCE-01",
  "schema_version": "1.0.0",
  "protocol_stage": "R5",
  "status": "RESULT_BLIND_DESIGN_FROZEN__NO_EFFECT_EXECUTION_AUTHORITY",
  "frozen_date": "2026-07-25",
  "author_authorization_text": "R5_FREEZE_AUTHORIZED",
  "material_passport": {
    "origin_skill": "academic-research-suite/experiment-agent",
    "origin_mode": "plan",
    "verification_status": "RESULT_BLIND_CONTRACT_VALIDATED",
    "version_label": "v11_r5_freeze_v1"
  },
  "result_awareness_boundary": {
    "legacy_g5c_effects_read_or_analyzed": false,
    "development_pilot_effects_read_or_analyzed": false,
    "v11_effect_execution_performed": false,
    "participant_level_data_accessed": false,
    "hidden_seed_or_instance_accessed_or_generated": false,
    "results_section_written": false,
    "effect_direction_assumed": false
  },
  "upstream_bindings": {
    "implementation_git_root": ".",
    "branch": "dev",
    "r4_base_commit": "c40da5960b129a4dcec0b426e556a42272f4a028",
    "r4_base_tree": "2dff77a621e8077eb52f2837eae19deaebb446b3",
    "r4_benchmark_registry": {
      "path": "config/r4/benchmark_registry.json",
      "sha256": "e912e62d05c0ffc4ca73feb0ac99669a0d8bf6fafdb257c0138d4803c4ec77b6"
    },
    "r4_comparator_manifest": {
      "path": "config/r4/comparator_manifest.json",
      "sha256": "3d547d66cd8fb707ac3d7a2c2cafe2e2ff525b188b57d5f810dfa70809d9216b"
    },
    "dependency_lock": {
      "path": "requirements-r4-benchmark.lock",
      "sha256": "67479ba5980fa02248bf0f30aa9f25c0b9013956c6639a1e2b5f7ff87e643be3"
    },
    "randomness_module": {
      "path": "src/evaluation/randomness.py",
      "sha256": "1ad83dc550d283a841a69f396878487c803d5283320fbede3a7357f8bb540c5c",
      "derivation_domain": "WGT-V11-RNG-v1"
    },
    "r3_model_qualification_status": "MODEL_QUALIFICATION_FAILED_POINT_MODEL_NOT_QUALIFIED_ONE_TIME_CONSUMED",
    "weight_case_name": "illustrative_mechanistic_simulation"
  },
  "common_configuration": {
    "population_size": 100,
    "archive_capacity": 100,
    "budget_unit": "joint_candidate_evaluation_CFE",
    "checkpoint_fractions": [
      0.0,
      0.05,
      0.1,
      0.15,
      0.2,
      0.25,
      0.3,
      0.35,
      0.4,
      0.45,
      0.5,
      0.55,
      0.6,
      0.65,
      0.7,
      0.75,
      0.8,
      0.85,
      0.9,
      0.95,
      1.0
    ],
    "transfer_checkpoint_fractions": [
      0.0,
      0.05,
      0.1,
      0.15,
      0.2
    ],
    "cfe_accounting": "Initialization, warm-start reevaluation, duplicates, cache hits and numerical evaluator failures are charged; repair failure before evaluator entry is zero CFE and typed.",
    "unused_budget_transfer_allowed": false,
    "silent_retry_allowed": false,
    "method_specific_budget_allowed": false,
    "post_result_sample_extension_allowed": false
  },
  "endpoint_contract": {
    "analysis_sets": {
      "FAS_SIM": "Every scheduled unit-method-replicate, including rejection, no-feasible, timeout, numerical failure and method-specific failure.",
      "VAS_SIM": "Runs with numerically valid continuous endpoints; no-feasible is nHV zero, timeout uses the last valid archive at the common cutoff, and numerical failure is not imputed as a continuous value.",
      "PPS_SIM": "Runs without a major infrastructure deviation; sensitivity analysis only."
    },
    "nhv": {
      "static_and_cdf_reference_front_points": 10000,
      "static_and_cdf_reference_front_source": "problem-specific analytic Pareto-front parameterization evaluated independently of every compared method",
      "normalization": "Per problem/event, use the analytic reference-front objective minima and maxima; divide by max(range,1e-12), clip to [0,1.1], use reference point 1.1 in every objective, and divide HV by 1.1^m.",
      "rolling_and_e3_transform": "For each nonnegative objective use phi(f)=f/(1+f), reference point all ones, and no observed-method union.",
      "empty_feasible_archive_value": 0.0,
      "observed_method_union_reference_allowed": false,
      "reference_failure_policy": "A missing, nonfinite or empty analytic reference set blocks the affected suite before effect execution; it is never replaced from observed method outputs."
    },
    "endpoint_ids": {
      "ANYTIME_NHV_AUC": "Trapezoidal area over the 21 fixed CFE fractions; static is one problem run and dynamic/rolling is the equal-weight event mean.",
      "FINAL_NHV": "nHV at 100 percent of the fixed CFE; dynamic/rolling is the equal-weight event mean.",
      "TRANSFER_EARLY_AUC": "Mean normalized trapezoidal area over 0 to 20 percent CFE after changes; event zero is excluded.",
      "NEGATIVE_TRANSFER_RATE": "Fraction of post-initial events whose paired early-AUC difference is below -0.01.",
      "FAILURE_RATE": "Typed non-ACCEPTED proportion in FAS-Sim with every terminal code retained.",
      "POST_EXECUTION_HARD_VIOLATION_RATE": "Executed events with a model-internal hard-constraint violation divided by all executed events.",
      "E3_ACCEPTED_FEASIBLE_EVENT_RATE": "Accepted and feasible weekly events divided by 26.",
      "E3_MASS_TARGET_ABS_ERROR_AUC": "Weekly trapezoidal AUC of abs(model-predicted mass-target mass)/max(initial mass,1 kg).",
      "COST": "CFE, atomic model steps, wall time, CPU time, peak RSS, output bytes and execution-transition count."
    },
    "practical_effect_thresholds": {
      "ANYTIME_NHV_AUC": 0.02,
      "FINAL_NHV": 0.02,
      "TRANSFER_EARLY_AUC": 0.03,
      "mechanism_attribution_TRANSFER": 0.01,
      "failure_or_rejection_absolute_risk_margin": 0.02,
      "post_execution_hard_violation_absolute_risk_margin": 0.01,
      "paired_wall_time_ratio_upper_margin": 1.5,
      "paired_peak_rss_ratio_upper_margin": 2.0
    }
  },
  "statistics_contract": {
    "top_level_units": {
      "E1_E2_static_dynamic": "problem_id; profile and paired replicate are fixed nested units",
      "E1_E2_rolling": "public generator template by index; paired replicate and event are nested",
      "E3": "public virtual_subject_id by scenario_id; paired replicate and week are nested"
    },
    "aggregation": "Average within paired replicate, then within fixed profile/template/scenario stratum, then macro-average top-level units with equal weight; never weight by candidate, event, week or raw run count.",
    "paired_effect_direction": "For higher-is-better endpoints use proposed minus comparator; for lower-is-better failure/cost endpoints orient the sign so positive favors the proposed method.",
    "confidence_interval": {
      "method": "paired stratified cluster bootstrap at the highest independent unit",
      "replicates": 20000,
      "level": 0.95,
      "interval": "percentile",
      "seed_u64": "18411052415373205191"
    },
    "permutation_test": {
      "method": "two-sided paired sign-flip preserving every nested seed/profile/event value within a top-level cluster",
      "replicates": 100000,
      "p_value": "(b+1)/(B+1)",
      "seed_u64": "12682445017195329024"
    },
    "multiplicity": {
      "procedure": "Holm step-down",
      "familywise_alpha": 0.05,
      "families": [
        {
          "family_id": "E1_PRIMARY_ANYTIME",
          "hypothesis_count": 15,
          "definition": "Five result-blind comparator contrasts in each of static, CDF and rolling on ANYTIME_NHV_AUC."
        },
        {
          "family_id": "E2_DYNAMIC_TRANSFER",
          "hypothesis_count": 7,
          "definition": "FULL versus the seven registered dynamic-identifiable variants on TRANSFER_EARLY_AUC."
        },
        {
          "family_id": "E2_ROLLING_TRANSFER",
          "hypothesis_count": 8,
          "definition": "FULL versus every other registered variant on TRANSFER_EARLY_AUC."
        }
      ],
      "e3_confirmatory_p_values_allowed": false
    },
    "missing_and_failure_rules": {
      "no_feasible_nhv": 0.0,
      "timeout_continuous_endpoint": "last valid archive at the common hard cutoff plus a timeout indicator",
      "numerical_failure_continuous_endpoint": "missing in VAS-Sim; report FAS-Sim risk and [0,1] worst/best bounds",
      "failure_removal_allowed": false,
      "unpaired_fallback_allowed": false,
      "optional_stopping_allowed": false
    },
    "reporting": [
      "point estimate",
      "effect size",
      "95 percent confidence interval",
      "raw top-level cluster distribution",
      "Holm-adjusted and unadjusted p values where confirmatory",
      "failure rejection infeasibility and timeout rates",
      "CFE atomic steps wall time CPU time peak RSS and bytes",
      "positive null negative and cost-ineligible outcomes"
    ],
    "p_value_only_conclusion_allowed": false
  },
  "seed_contract": {
    "paired_master_seed_derivation": "First 8 bytes big-endian of SHA256(UTF-8('WGT-V11-R5-PAIRED-MASTER-v1\\0' || decimal replicate index)).",
    "paired_master_seeds_u64": [
      "1814705672717120344",
      "11510044127855585889",
      "2013063862857590834",
      "9940308221477475016",
      "10545341458691982268",
      "30948576425451958",
      "7493590094546507899",
      "3295734562444817625",
      "14507337277246372461",
      "1039750163339046496"
    ],
    "paired_master_seed_table_sha256": "ddbe68251add06059a42d2485a42cb29f22b1c21f9061094ccf60ba2556f35db",
    "use_prefix_counts": {
      "E1_STATIC": 10,
      "E1_DYNAMIC": 5,
      "E1_ROLLING": 5,
      "E2_DYNAMIC": 5,
      "E2_ROLLING": 5,
      "E3": 3
    },
    "stream_pairing": {
      "shared_without_method_id": [
        "instance",
        "initialization",
        "observation",
        "execution"
      ],
      "method_isolated_with_method_id": [
        "algorithm"
      ],
      "rule": "The paired replicate label and environment are common across methods; optimizer/operator streams include method_id and are independently domain-separated."
    },
    "rolling_public_generator": {
      "generator_id": "WGT-F23-RRGEN-01",